{
  "schemaVersion": "1.0.0",
  "contentVersion": "2026-07-20.1",
  "generatedAt": "2026-07-20T12:36:48.575Z",
  "questionCount": 30,
  "questions": [
    {
      "id": "u01-calendar-weekday-0009",
      "revision": "19bf3d4b43e28c411d5f2e362befbfb4d58f8b99e27278946983ecd660a50bca",
      "file": "questions/u01-calendar-weekday-0009.json",
      "unit": {
        "id": "unit-01",
        "name": "約数と倍数"
      },
      "gradeLevel": "junior-high-review",
      "difficulty": {
        "label": "intro",
        "score": 1
      },
      "problemType": "calendar-weekday-modulo-basic",
      "tags": [
        "multiple",
        "remainder",
        "calendar"
      ]
    },
    {
      "id": "u01-common-remainder-divisor-0008",
      "revision": "1ccda56d995758522a457910d91d23fccfcf49dab8353434141805654fd01657",
      "file": "questions/u01-common-remainder-divisor-0008.json",
      "unit": {
        "id": "unit-01",
        "name": "約数と倍数"
      },
      "gradeLevel": "junior-high-review",
      "difficulty": {
        "label": "intro",
        "score": 1
      },
      "problemType": "common-remainder-divisor-basic",
      "tags": [
        "divisor",
        "gcd",
        "remainder"
      ]
    },
    {
      "id": "u01-common-remainder-lcm-0007",
      "revision": "057203bc45a12e876dd3635c852b33375f2c69066fac9d9e194cb7e239b8b656",
      "file": "questions/u01-common-remainder-lcm-0007.json",
      "unit": {
        "id": "unit-01",
        "name": "約数と倍数"
      },
      "gradeLevel": "junior-high-review",
      "difficulty": {
        "label": "standard",
        "score": 2
      },
      "problemType": "common-remainder-lcm-basic",
      "tags": [
        "multiple",
        "lcm",
        "remainder"
      ]
    },
    {
      "id": "u01-congruence-nearest-0010",
      "revision": "aa8c9935012add6d1043ebed60cb28aa0b5cca3448c72be8e4765bae74e3475a",
      "file": "questions/u01-congruence-nearest-0010.json",
      "unit": {
        "id": "unit-01",
        "name": "約数と倍数"
      },
      "gradeLevel": "junior-high-review",
      "difficulty": {
        "label": "standard",
        "score": 2
      },
      "problemType": "congruence-nearest-basic",
      "tags": [
        "multiple",
        "lcm",
        "remainder"
      ]
    },
    {
      "id": "u01-divisors-multiples-0001",
      "revision": "a9e7e7e4f52d21d04a0d03d28fd5b586f894fe4912dbc07edf8e2a33da14a6ed",
      "file": "questions/u01-divisors-multiples-0001.json",
      "unit": {
        "id": "unit-01",
        "name": "約数と倍数"
      },
      "gradeLevel": "junior-high-review",
      "difficulty": {
        "label": "intro",
        "score": 1
      },
      "problemType": "common-divisor-basic",
      "tags": [
        "divisor",
        "multiple",
        "gcd"
      ]
    },
    {
      "id": "u01-gcd-lcm-0004",
      "revision": "d7e730c6280bc1899d55d1113b523c0b121346555894ab220e7d479c7f8ac15b",
      "file": "questions/u01-gcd-lcm-0004.json",
      "unit": {
        "id": "unit-01",
        "name": "約数と倍数"
      },
      "gradeLevel": "junior-high-review",
      "difficulty": {
        "label": "standard",
        "score": 2
      },
      "problemType": "gcd-lcm-basic",
      "tags": [
        "divisor",
        "multiple",
        "gcd",
        "lcm"
      ]
    },
    {
      "id": "u01-gcd-lcm-relation-0005",
      "revision": "ac8162e7f03591937e21d94848ecaf22c62bdd94ba7a7cfab5764d78bf0047b3",
      "file": "questions/u01-gcd-lcm-relation-0005.json",
      "unit": {
        "id": "unit-01",
        "name": "約数と倍数"
      },
      "gradeLevel": "junior-high-review",
      "difficulty": {
        "label": "standard",
        "score": 2
      },
      "problemType": "gcd-lcm-relation-basic",
      "tags": [
        "divisor",
        "multiple",
        "gcd",
        "lcm"
      ]
    },
    {
      "id": "u01-prime-factorization-0003",
      "revision": "5f05e395ba33bbc5246d70d0c28592a74726888931d42ab0632e846ccfc92c30",
      "file": "questions/u01-prime-factorization-0003.json",
      "unit": {
        "id": "unit-01",
        "name": "約数と倍数"
      },
      "gradeLevel": "junior-high-review",
      "difficulty": {
        "label": "intro",
        "score": 1
      },
      "problemType": "prime-factorization-basic",
      "tags": [
        "divisor",
        "prime-factorization"
      ]
    },
    {
      "id": "u01-prime-list-0002",
      "revision": "30473137cc5921d7a4e7cc96265dfc438cc9abe627fc1bb4c9ce6099c5c70f01",
      "file": "questions/u01-prime-list-0002.json",
      "unit": {
        "id": "unit-01",
        "name": "約数と倍数"
      },
      "gradeLevel": "junior-high-review",
      "difficulty": {
        "label": "intro",
        "score": 1
      },
      "problemType": "prime-list-range-basic",
      "tags": [
        "divisor",
        "prime"
      ]
    },
    {
      "id": "u01-remainder-divisors-0006",
      "revision": "2acceed6f0e7d433f2bd5dea62feae35cc1b152573d9c0f193298519a2530151",
      "file": "questions/u01-remainder-divisors-0006.json",
      "unit": {
        "id": "unit-01",
        "name": "約数と倍数"
      },
      "gradeLevel": "junior-high-review",
      "difficulty": {
        "label": "intro",
        "score": 1
      },
      "problemType": "remainder-divisors-basic",
      "tags": [
        "divisor",
        "remainder"
      ]
    },
    {
      "id": "u02-radical-calculation-0004",
      "revision": "5ab7e8df7f2eac63ac2987188e937fd9f228445dc775d13a91d65f975405f009",
      "file": "questions/u02-radical-calculation-0004.json",
      "unit": {
        "id": "unit-02",
        "name": "根号を含む式"
      },
      "gradeLevel": "high-school-basic",
      "difficulty": {
        "label": "standard",
        "score": 2
      },
      "problemType": "radical-calculation-basic",
      "tags": [
        "radical",
        "calculation",
        "expansion"
      ]
    },
    {
      "id": "u02-radical-fraction-calculate-0006",
      "revision": "cf3885cd5606d972c936a34450554ef5c7e8074dfe1bf8a189f1934b9fa56643",
      "file": "questions/u02-radical-fraction-calculate-0006.json",
      "unit": {
        "id": "unit-02",
        "name": "根号を含む式"
      },
      "gradeLevel": "high-school-basic",
      "difficulty": {
        "label": "standard",
        "score": 2
      },
      "problemType": "radical-fraction-calculation-basic",
      "tags": [
        "radical",
        "rationalization",
        "calculation"
      ]
    },
    {
      "id": "u02-radical-simplify-0003",
      "revision": "97f1cf988f46a3002ae1644486db83f640917483d90b5e680e98410f77e08b4e",
      "file": "questions/u02-radical-simplify-0003.json",
      "unit": {
        "id": "unit-02",
        "name": "根号を含む式"
      },
      "gradeLevel": "high-school-basic",
      "difficulty": {
        "label": "intro",
        "score": 1
      },
      "problemType": "radical-simplify-basic",
      "tags": [
        "radical",
        "simplify"
      ]
    },
    {
      "id": "u02-radicals-0001",
      "revision": "f45ac9fb9ef97ab4c5ea5fe3a5a09ce1d156e10e2b91a4f50338aaf8113a711e",
      "file": "questions/u02-radicals-0001.json",
      "unit": {
        "id": "unit-02",
        "name": "根号を含む式"
      },
      "gradeLevel": "high-school-basic",
      "difficulty": {
        "label": "intro",
        "score": 1
      },
      "problemType": "radical-simplify-basic",
      "tags": [
        "radical",
        "simplify"
      ]
    },
    {
      "id": "u02-radicals-0002",
      "revision": "ee9387ac73baf747317eb0dd93bdbea480d922308d432c9fc3ae37803f8d9c5a",
      "file": "questions/u02-radicals-0002.json",
      "unit": {
        "id": "unit-02",
        "name": "根号を含む式"
      },
      "gradeLevel": "junior-high-review",
      "difficulty": {
        "label": "intro",
        "score": 1
      },
      "problemType": "vocabulary-square-number-basic",
      "tags": [
        "radical",
        "vocabulary",
        "square-number"
      ]
    },
    {
      "id": "u02-rationalize-denominator-0005",
      "revision": "83fa48e48b3c156c042d8d8de5555e3ac450234a63901dc0e4789fdd2fb3dabe",
      "file": "questions/u02-rationalize-denominator-0005.json",
      "unit": {
        "id": "unit-02",
        "name": "根号を含む式"
      },
      "gradeLevel": "high-school-basic",
      "difficulty": {
        "label": "standard",
        "score": 2
      },
      "problemType": "rationalize-denominator-basic",
      "tags": [
        "radical",
        "rationalization"
      ]
    },
    {
      "id": "u03-expression-value-0001",
      "revision": "4812266248f5d0511bebf7be822e6b2bea0f388b99311f1da43053d663f75de9",
      "file": "questions/u03-expression-value-0001.json",
      "unit": {
        "id": "unit-03",
        "name": "式の値"
      },
      "gradeLevel": "junior-high-review",
      "difficulty": {
        "label": "intro",
        "score": 1
      },
      "problemType": "substitution-basic",
      "tags": [
        "substitution",
        "expression"
      ]
    },
    {
      "id": "u03-expression-value-0002",
      "revision": "59cf478cf6aeaccb886e64282e522c5202c9c6bb449273321448cc4cd6b84095",
      "file": "questions/u03-expression-value-0002.json",
      "unit": {
        "id": "unit-03",
        "name": "式の値"
      },
      "gradeLevel": "high-school-basic",
      "difficulty": {
        "label": "standard",
        "score": 2
      },
      "problemType": "expression-value-basic",
      "tags": [
        "expression",
        "substitution",
        "radical"
      ]
    },
    {
      "id": "u04-linear-equation-0001",
      "revision": "d9deaacb4a1f54a4083e0644d3d9122558fb54b9c3a5362ae64b155207550abb",
      "file": "questions/u04-linear-equation-0001.json",
      "unit": {
        "id": "unit-04",
        "name": "1次方程式"
      },
      "gradeLevel": "junior-high-review",
      "difficulty": {
        "label": "standard",
        "score": 2
      },
      "problemType": "linear-equation-basic",
      "tags": [
        "equation",
        "linear"
      ]
    },
    {